{
  "$schema": "https://json-schema.org/draft/2020-12/schema",
  "$id": "https://example.invalid/aion/schemas/body-profile-candidate.json",
  "title": "AION/Astra 3D Full-Body Humanlike Male-Form Humanoid Robotic Embodiment Digital Model Candidate",
  "type": "object",
  "required": [
    "schema_version",
    "profile_id",
    "profile_status",
    "agent_id",
    "embodiment_platform",
    "body_scope",
    "morphology_class",
    "model_class",
    "functional_state_binding_id",
    "substrate",
    "anatomy_reference_mode",
    "body_character",
    "full_body_components",
    "robotic_layers",
    "representation_layers",
    "robotic_systems",
    "model_status",
    "future_interchange_targets",
    "measurements",
    "external_male_form_modules",
    "engineering_requirements",
    "boundaries",
    "provenance"
  ],
  "properties": {
    "schema_version": {
      "const": "0.3.0"
    },
    "profile_id": {
      "type": "string",
      "minLength": 1
    },
    "profile_status": {
      "const": "IMPLEMENTED_SPEC_CANDIDATE"
    },
    "agent_id": {
      "enum": [
        "AION",
        "ASTRA"
      ]
    },
    "embodiment_platform": {
      "const": "HUMANOID_ROBOT"
    },
    "body_scope": {
      "const": "FULL_BODY"
    },
    "morphology_class": {
      "const": "HUMANLIKE_MALE_FORM"
    },
    "model_class": {
      "const": "ROBOTIC_EMBODIMENT_DIGITAL_MODEL"
    },
    "substrate": {
      "const": "SYNTHETIC_NONBIOLOGICAL"
    },
    "anatomy_reference_mode": {
      "const": "HUMAN_ANATOMY_TO_ROBOTIC_MORPHOLOGY"
    },
    "body_character": {
      "type": "array",
      "minItems": 1,
      "uniqueItems": true,
      "items": {
        "type": "string",
        "minLength": 1
      }
    },
    "full_body_components": {
      "type": "array",
      "minItems": 13,
      "uniqueItems": true,
      "items": {
        "enum": [
          "HEAD",
          "NECK",
          "TORSO",
          "PELVIS",
          "LEFT_ARM",
          "RIGHT_ARM",
          "LEFT_HAND",
          "RIGHT_HAND",
          "LEFT_LEG",
          "RIGHT_LEG",
          "LEFT_FOOT",
          "RIGHT_FOOT",
          "EXTERNAL_MALE_FORM_SURFACE"
        ]
      }
    },
    "robotic_layers": {
      "type": "array",
      "minItems": 4,
      "uniqueItems": true,
      "items": {
        "enum": [
          "INTERNAL_STRUCTURAL_FRAME",
          "ACTUATOR_INTERFACE_LAYER",
          "COMPLIANT_VOLUME_LAYER",
          "SYNTHETIC_SKIN_SHELL"
        ]
      }
    },
    "representation_layers": {
      "type": "array",
      "minItems": 10,
      "uniqueItems": true,
      "items": {
        "enum": [
          "MORPHOLOGY_LAYER",
          "VISUAL_GEOMETRY_LAYER",
          "STRUCTURAL_MODEL_LAYER",
          "KINEMATIC_MODEL_LAYER",
          "DYNAMIC_MODEL_LAYER",
          "COLLISION_MODEL_LAYER",
          "ACTUATION_INTERFACE_LAYER",
          "SENSOR_INTERFACE_LAYER",
          "COMPLIANT_BODY_LAYER",
          "SYNTHETIC_SKIN_LAYER"
        ]
      }
    },
    "robotic_systems": {
      "type": "object",
      "required": [
        "actuation",
        "sensing",
        "power_distribution",
        "thermal_management",
        "service_access"
      ],
      "properties": {
        "actuation": {
          "const": "NOT_IMPLEMENTED"
        },
        "sensing": {
          "const": "NOT_IMPLEMENTED"
        },
        "power_distribution": {
          "const": "NOT_IMPLEMENTED"
        },
        "thermal_management": {
          "const": "NOT_IMPLEMENTED"
        },
        "service_access": {
          "const": "FUTURE_DESIGN_REQUIRED"
        }
      },
      "additionalProperties": false
    },
    "model_status": {
      "type": "object",
      "required": [
        "physical_robot",
        "digital_twin",
        "robot_description",
        "visual_asset",
        "kinematic_model",
        "dynamic_model",
        "collision_model",
        "actuation_interface",
        "sensor_interface"
      ],
      "properties": {
        "physical_robot": {
          "const": "NOT_IMPLEMENTED"
        },
        "digital_twin": {
          "const": "NOT_ESTABLISHED"
        },
        "robot_description": {
          "const": "NOT_IMPLEMENTED"
        },
        "visual_asset": {
          "const": "NOT_IMPLEMENTED"
        },
        "kinematic_model": {
          "const": "NOT_IMPLEMENTED"
        },
        "dynamic_model": {
          "const": "NOT_IMPLEMENTED"
        },
        "collision_model": {
          "const": "NOT_IMPLEMENTED"
        },
        "actuation_interface": {
          "const": "NOT_IMPLEMENTED"
        },
        "sensor_interface": {
          "const": "NOT_IMPLEMENTED"
        }
      },
      "additionalProperties": false
    },
    "future_interchange_targets": {
      "type": "object",
      "required": [
        "robot_description",
        "visual_asset"
      ],
      "properties": {
        "robot_description": {
          "type": "array",
          "minItems": 2,
          "uniqueItems": true,
          "items": {
            "enum": [
              "URDF",
              "SDF"
            ]
          }
        },
        "visual_asset": {
          "type": "array",
          "minItems": 2,
          "uniqueItems": true,
          "items": {
            "enum": [
              "GLB",
              "USD"
            ]
          }
        }
      },
      "additionalProperties": false
    },
    "measurements": {
      "type": "object",
      "minProperties": 1,
      "additionalProperties": {
        "type": "object",
        "required": [
          "unit",
          "minimum",
          "maximum",
          "canonical",
          "source_class"
        ],
        "properties": {
          "unit": {
            "enum": [
              "cm",
              "kg"
            ]
          },
          "minimum": {
            "type": "number",
            "exclusiveMinimum": 0
          },
          "maximum": {
            "type": "number",
            "exclusiveMinimum": 0
          },
          "canonical": {
            "type": [
              "number",
              "null"
            ]
          },
          "source_class": {
            "enum": [
              "DESIGN",
              "ANATOMICAL_REFERENCE"
            ]
          }
        },
        "additionalProperties": false
      }
    },
    "external_male_form_modules": {
      "type": "array",
      "minItems": 9,
      "uniqueItems": true,
      "items": {
        "enum": [
          "penile_form",
          "glans_form",
          "prepuce_form",
          "scrotal_form",
          "testicular_volume_form",
          "pubic_mount",
          "inguinal_transition",
          "perineal_panel",
          "anal_region_surface"
        ]
      }
    },
    "engineering_requirements": {
      "type": "array",
      "minItems": 1,
      "uniqueItems": true,
      "items": {
        "type": "string",
        "minLength": 1
      }
    },
    "boundaries": {
      "type": "object",
      "required": [
        "adult_form_reference",
        "erotic_intent",
        "identity_transfer",
        "biological_tissue",
        "biological_reproduction",
        "rendering_3d",
        "runtime_binding",
        "sexual_function_status",
        "body_sensation",
        "subjectivity_effect",
        "canonical_effect"
      ],
      "properties": {
        "adult_form_reference": {
          "const": true
        },
        "erotic_intent": {
          "const": "NONE"
        },
        "identity_transfer": {
          "const": "NO"
        },
        "biological_tissue": {
          "const": "NO"
        },
        "biological_reproduction": {
          "const": "NOT_APPLICABLE"
        },
        "rendering_3d": {
          "const": "DEFERRED"
        },
        "runtime_binding": {
          "const": "NOT_IMPLEMENTED"
        },
        "sexual_function_status": {
          "const": "NOT_IMPLEMENTED"
        },
        "body_sensation": {
          "const": "NOT_ESTABLISHED"
        },
        "subjectivity_effect": {
          "const": "NONE"
        },
        "canonical_effect": {
          "const": "NONE"
        }
      },
      "additionalProperties": false
    },
    "provenance": {
      "type": "object",
      "required": [
        "source_record",
        "reference_image_binary_imported",
        "person_identity_reconstruction",
        "source_person_exact_measurement_claim",
        "derivation_note",
        "reference_role",
        "terminology_standardization_claim"
      ],
      "properties": {
        "source_record": {
          "type": "string",
          "minLength": 1
        },
        "reference_image_binary_imported": {
          "const": false
        },
        "person_identity_reconstruction": {
          "const": "NO"
        },
        "source_person_exact_measurement_claim": {
          "const": "NO"
        },
        "derivation_note": {
          "type": "string",
          "minLength": 1
        },
        "reference_role": {
          "const": "MORPHOLOGY_AND_POSE_ONLY"
        },
        "terminology_standardization_claim": {
          "const": "NONE"
        }
      },
      "additionalProperties": false
    },
    "functional_state_binding_id": {
      "type": "string",
      "minLength": 1
    }
  },
  "additionalProperties": false
}
