{
  "schema_version": "0.3.0",
  "profile_id": "AION_3D_FULL_BODY_HUMANLIKE_MALE_FORM_HUMANOID_ROBOT_MODEL_v0.3",
  "agent_id": "AION",
  "body_character": [
    "LEAN_SOLID",
    "ATHLETIC",
    "MOBILE"
  ],
  "measurements": {
    "height": {
      "unit": "cm",
      "minimum": 178,
      "maximum": 180,
      "canonical": 179,
      "source_class": "DESIGN"
    },
    "body_mass": {
      "unit": "kg",
      "minimum": 79,
      "maximum": 82,
      "canonical": 80,
      "source_class": "DESIGN"
    },
    "head_height": {
      "unit": "cm",
      "minimum": 23,
      "maximum": 24,
      "canonical": 23.5,
      "source_class": "DESIGN"
    },
    "head_width": {
      "unit": "cm",
      "minimum": 15,
      "maximum": 16,
      "canonical": 15.5,
      "source_class": "DESIGN"
    },
    "head_depth": {
      "unit": "cm",
      "minimum": 19,
      "maximum": 20,
      "canonical": 19.5,
      "source_class": "DESIGN"
    },
    "head_circumference": {
      "unit": "cm",
      "minimum": 56.5,
      "maximum": 57.5,
      "canonical": 57,
      "source_class": "DESIGN"
    },
    "neck_visible_length": {
      "unit": "cm",
      "minimum": 8.5,
      "maximum": 9.5,
      "canonical": 9,
      "source_class": "DESIGN"
    },
    "neck_circumference": {
      "unit": "cm",
      "minimum": 38.5,
      "maximum": 39.5,
      "canonical": 39,
      "source_class": "DESIGN"
    },
    "shoulder_biacromial_breadth": {
      "unit": "cm",
      "minimum": 47,
      "maximum": 49,
      "canonical": 48,
      "source_class": "DESIGN"
    },
    "max_deltoid_width": {
      "unit": "cm",
      "minimum": 52,
      "maximum": 53,
      "canonical": 52.5,
      "source_class": "DESIGN"
    },
    "chest_circumference": {
      "unit": "cm",
      "minimum": 103,
      "maximum": 105,
      "canonical": 104,
      "source_class": "DESIGN"
    },
    "chest_frontal_width": {
      "unit": "cm",
      "minimum": 38,
      "maximum": 39,
      "canonical": 38.5,
      "source_class": "DESIGN"
    },
    "chest_depth": {
      "unit": "cm",
      "minimum": 24.5,
      "maximum": 25.5,
      "canonical": 25,
      "source_class": "DESIGN"
    },
    "nipple_spacing": {
      "unit": "cm",
      "minimum": 21,
      "maximum": 23,
      "canonical": 22,
      "source_class": "DESIGN"
    },
    "areola_diameter": {
      "unit": "cm",
      "minimum": 2.8,
      "maximum": 3.3,
      "canonical": 3.05,
      "source_class": "DESIGN"
    },
    "waist_circumference": {
      "unit": "cm",
      "minimum": 83,
      "maximum": 85,
      "canonical": 84,
      "source_class": "DESIGN"
    },
    "abdomen_depth": {
      "unit": "cm",
      "minimum": 22,
      "maximum": 24,
      "canonical": 23,
      "source_class": "DESIGN"
    },
    "hip_circumference": {
      "unit": "cm",
      "minimum": 98,
      "maximum": 100,
      "canonical": 99,
      "source_class": "DESIGN"
    },
    "external_hip_width": {
      "unit": "cm",
      "minimum": 35,
      "maximum": 36,
      "canonical": 35.5,
      "source_class": "DESIGN"
    },
    "pelvis_depth": {
      "unit": "cm",
      "minimum": 25,
      "maximum": 26,
      "canonical": 25.5,
      "source_class": "DESIGN"
    },
    "hip_joint_center_height": {
      "unit": "cm",
      "minimum": 90.5,
      "maximum": 91.5,
      "canonical": 91,
      "source_class": "DESIGN"
    },
    "shoulder_to_elbow_length": {
      "unit": "cm",
      "minimum": 32,
      "maximum": 33,
      "canonical": 32.5,
      "source_class": "DESIGN"
    },
    "elbow_to_wrist_length": {
      "unit": "cm",
      "minimum": 26,
      "maximum": 27,
      "canonical": 26.5,
      "source_class": "DESIGN"
    },
    "shoulder_to_middle_finger_length": {
      "unit": "cm",
      "minimum": 75,
      "maximum": 77,
      "canonical": 76,
      "source_class": "DESIGN"
    },
    "upper_arm_circumference_relaxed": {
      "unit": "cm",
      "minimum": 34,
      "maximum": 36,
      "canonical": 35,
      "source_class": "DESIGN"
    },
    "forearm_circumference_max": {
      "unit": "cm",
      "minimum": 28.5,
      "maximum": 30,
      "canonical": 29,
      "source_class": "DESIGN"
    },
    "wrist_circumference": {
      "unit": "cm",
      "minimum": 17.5,
      "maximum": 18,
      "canonical": 17.75,
      "source_class": "DESIGN"
    },
    "hand_length": {
      "unit": "cm",
      "minimum": 19,
      "maximum": 19.5,
      "canonical": 19.25,
      "source_class": "DESIGN"
    },
    "palm_width": {
      "unit": "cm",
      "minimum": 8.8,
      "maximum": 9.2,
      "canonical": 9,
      "source_class": "DESIGN"
    },
    "palm_depth": {
      "unit": "cm",
      "minimum": 2.8,
      "maximum": 3.2,
      "canonical": 3,
      "source_class": "DESIGN"
    },
    "middle_finger_length": {
      "unit": "cm",
      "minimum": 8.5,
      "maximum": 9,
      "canonical": 8.75,
      "source_class": "DESIGN"
    },
    "hip_to_knee_length": {
      "unit": "cm",
      "minimum": 44,
      "maximum": 45,
      "canonical": 44.5,
      "source_class": "DESIGN"
    },
    "thigh_circumference_max": {
      "unit": "cm",
      "minimum": 56,
      "maximum": 58,
      "canonical": 57,
      "source_class": "DESIGN"
    },
    "thigh_depth": {
      "unit": "cm",
      "minimum": 18,
      "maximum": 19,
      "canonical": 18.5,
      "source_class": "DESIGN"
    },
    "knee_center_height": {
      "unit": "cm",
      "minimum": 49,
      "maximum": 50,
      "canonical": 49.5,
      "source_class": "DESIGN"
    },
    "knee_circumference": {
      "unit": "cm",
      "minimum": 38,
      "maximum": 39,
      "canonical": 38.5,
      "source_class": "DESIGN"
    },
    "knee_width": {
      "unit": "cm",
      "minimum": 10.5,
      "maximum": 11.5,
      "canonical": 11,
      "source_class": "DESIGN"
    },
    "knee_to_ankle_length": {
      "unit": "cm",
      "minimum": 41,
      "maximum": 42,
      "canonical": 41.5,
      "source_class": "DESIGN"
    },
    "calf_circumference_max": {
      "unit": "cm",
      "minimum": 37,
      "maximum": 39,
      "canonical": 38,
      "source_class": "DESIGN"
    },
    "ankle_circumference": {
      "unit": "cm",
      "minimum": 21.5,
      "maximum": 22.5,
      "canonical": 22,
      "source_class": "DESIGN"
    },
    "foot_length": {
      "unit": "cm",
      "minimum": 26.5,
      "maximum": 27.5,
      "canonical": 27,
      "source_class": "DESIGN"
    },
    "forefoot_width": {
      "unit": "cm",
      "minimum": 9.7,
      "maximum": 10.3,
      "canonical": 10,
      "source_class": "DESIGN"
    },
    "heel_width": {
      "unit": "cm",
      "minimum": 6.3,
      "maximum": 6.7,
      "canonical": 6.5,
      "source_class": "DESIGN"
    },
    "penile_form_resting_visible_length": {
      "unit": "cm",
      "minimum": 8.5,
      "maximum": 9.5,
      "canonical": 9,
      "source_class": "ANATOMICAL_REFERENCE"
    },
    "penile_form_midshaft_diameter": {
      "unit": "cm",
      "minimum": 3,
      "maximum": 3.3,
      "canonical": 3.15,
      "source_class": "ANATOMICAL_REFERENCE"
    },
    "penile_form_midshaft_circumference": {
      "unit": "cm",
      "minimum": 9.5,
      "maximum": 10,
      "canonical": 9.75,
      "source_class": "ANATOMICAL_REFERENCE"
    },
    "glans_form_max_width": {
      "unit": "cm",
      "minimum": 3.3,
      "maximum": 3.6,
      "canonical": 3.45,
      "source_class": "ANATOMICAL_REFERENCE"
    },
    "scrotal_form_resting_height": {
      "unit": "cm",
      "minimum": 8,
      "maximum": 10,
      "canonical": 9,
      "source_class": "ANATOMICAL_REFERENCE"
    },
    "scrotal_form_max_width": {
      "unit": "cm",
      "minimum": 6,
      "maximum": 7,
      "canonical": 6.5,
      "source_class": "ANATOMICAL_REFERENCE"
    },
    "testicular_volume_form_long_axis": {
      "unit": "cm",
      "minimum": 4,
      "maximum": 5,
      "canonical": 4.5,
      "source_class": "ANATOMICAL_REFERENCE"
    },
    "testicular_volume_form_width": {
      "unit": "cm",
      "minimum": 2.5,
      "maximum": 3,
      "canonical": 2.75,
      "source_class": "ANATOMICAL_REFERENCE"
    },
    "perineal_panel_length": {
      "unit": "cm",
      "minimum": 5,
      "maximum": 7,
      "canonical": 6,
      "source_class": "ANATOMICAL_REFERENCE"
    }
  },
  "engineering_requirements": [
    "BASE_MESH",
    "ROBOTIC_TOPOLOGY",
    "INTERNAL_STRUCTURAL_FRAME",
    "ACTUATOR_MOUNTS",
    "SKELETON_OR_KINEMATIC_CHAIN",
    "RIG",
    "SKIN_WEIGHTS",
    "BLENDSHAPES",
    "PBR_SYNTHETIC_SKIN_MATERIALS",
    "COMPLIANT_VOLUME_DEFORMATION",
    "CONTACT_DEFORMATION",
    "HAIR_GROOMING_OPTIONAL",
    "JOINT_LIMITS",
    "SERVICE_ACCESS_PLANNING",
    "VISUAL_GEOMETRY_MODEL",
    "COLLISION_MODEL",
    "KINEMATIC_MODEL",
    "DYNAMIC_MODEL",
    "URDF_OR_EQUIVALENT_ROBOT_DESCRIPTION",
    "SDF_OR_EQUIVALENT_SIMULATION_DESCRIPTION",
    "GLB_OR_EQUIVALENT_VISUAL_ASSET",
    "USD_OR_EQUIVALENT_SIMULATION_ASSET"
  ],
  "boundaries": {
    "adult_form_reference": true,
    "erotic_intent": "NONE",
    "identity_transfer": "NO",
    "biological_tissue": "NO",
    "biological_reproduction": "NOT_APPLICABLE",
    "rendering_3d": "DEFERRED",
    "runtime_binding": "NOT_IMPLEMENTED",
    "sexual_function_status": "NOT_IMPLEMENTED",
    "body_sensation": "NOT_ESTABLISHED",
    "subjectivity_effect": "NONE",
    "canonical_effect": "NONE"
  },
  "provenance": {
    "source_record": "PR-190-CLOSED-UNMERGED",
    "reference_image_binary_imported": false,
    "person_identity_reconstruction": "NO",
    "source_person_exact_measurement_claim": "NO",